<?xml version="1.0" encoding="utf-8"?>
<transfers xmlns="transfer-schema"
           xmlns:xsi="http://www.w3.org/2001/XMLSchema-instance"
           xsi:schemaLocation="transfer-schema ../../../Transfer/Templates/schema.xsd">

    <transfer name="DauerParker">
        <property name="vorname" type="string"/>
        <property name="nachname" type="string"/>
    </transfer>

    <transfer name="Parker">
        <property name="id" type="int"/>
        <property name="kennzeichen" type="string"/>
        <property name="dauerparkerId" type="int"/>
    </transfer>
</transfers>
